{
  "$schema": "https://json-schema.org/draft/2020-12/schema",
  "$id": "klode-kit/receipt.json",
  "title": "Step receipt",
  "description": "work/<batch>/receipts/<step>.json (02 r2.4, r2.6, r3.2): done is reused only when inputs_hash, config_hash and outputs[].sha256 all match. A finished receipt (done / failed) carries ended and exit_code.",
  "type": "object",
  "additionalProperties": false,
  "required": [
    "schema",
    "step",
    "status",
    "started",
    "inputs_hash",
    "config_hash",
    "config_version",
    "outputs"
  ],
  "properties": {
    "schema": {
      "const": "klode-kit.receipt/1"
    },
    "step": {
      "type": "string",
      "pattern": "^[a-z][a-z0-9_]*$"
    },
    "status": {
      "enum": [
        "running",
        "done",
        "failed"
      ]
    },
    "started": {
      "type": "string",
      "pattern": "^\\d{4}-\\d{2}-\\d{2}T\\d{2}:\\d{2}:\\d{2}(\\.\\d+)?(Z|[+-]\\d{2}:\\d{2})$"
    },
    "ended": {
      "type": "string",
      "pattern": "^\\d{4}-\\d{2}-\\d{2}T\\d{2}:\\d{2}:\\d{2}(\\.\\d+)?(Z|[+-]\\d{2}:\\d{2})$"
    },
    "inputs_hash": {
      "type": "string",
      "pattern": "^[0-9a-f]{64}$"
    },
    "config_hash": {
      "type": "string",
      "pattern": "^[0-9a-f]{64}$"
    },
    "config_version": {
      "type": "integer",
      "minimum": 1
    },
    "outputs": {
      "type": "array",
      "items": {
        "type": "object",
        "additionalProperties": false,
        "required": [
          "path",
          "sha256"
        ],
        "properties": {
          "path": {
            "type": "string",
            "minLength": 1
          },
          "sha256": {
            "type": "string",
            "pattern": "^[0-9a-f]{64}$"
          }
        }
      }
    },
    "model": {
      "type": [
        "string",
        "null"
      ]
    },
    "effort": {
      "type": [
        "string",
        "null"
      ]
    },
    "cost_usd": {
      "type": [
        "number",
        "null"
      ],
      "minimum": 0
    },
    "exit_code": {
      "type": "integer",
      "minimum": 0,
      "maximum": 255
    },
    "pid": {
      "type": "integer",
      "minimum": 1
    },
    "loop": {
      "type": "integer",
      "minimum": 0
    },
    "excluded": {
      "type": "array",
      "items": {
        "type": "object",
        "additionalProperties": false,
        "required": [
          "rec_id",
          "reason"
        ],
        "properties": {
          "rec_id": {
            "type": "string",
            "pattern": "^r-[0-9a-f]{12}$"
          },
          "reason": {
            "type": "string",
            "minLength": 1
          }
        }
      }
    }
  },
  "allOf": [
    {
      "if": {
        "required": [
          "status"
        ],
        "properties": {
          "status": {
            "const": "running"
          }
        }
      },
      "else": {
        "required": [
          "ended",
          "exit_code"
        ]
      }
    }
  ]
}
